{
  "company": "Salesforce",
  "role": "Summer Software Engineer Intern",
  "jobType": "internship",
  "batchYears": [
    "2028",
    "2027",
    "2026",
    "2025"
  ],
  "qualifications": [
    "B.E",
    "B.Tech",
    "M.E",
    "M.Tech",
    "BCA",
    "MCA",
    "B.Sc",
    "M.S"
  ],
  "experienceRequired": "Freshers",
  "salary": "Highly Competitive / Best in Industry",
  "locations": [
    "Bangalore",
    "Hyderabad"
  ],
  "lastDateToApply": "ASAP",
  "applyUrl": "https://salesforce.wd12.myworkdayjobs.com/External_Career_Site/job/India---Bangalore/Summer-2027-Intern---Software-Engineer_JR337715",
  "skills": [
    "Java",
    "C++",
    "Python",
    "Object-Oriented Design",
    "Data Structures",
    "Algorithm Development",
    "Complexity Analysis",
    "HTML",
    "CSS",
    "JavaScript",
    "React",
    "Angular",
    "Vue.js",
    "SQL",
    "Relational Database Concepts"
  ],
  "requirements": [
    "Target Batch: Strictly for the Class of 2028",
    "Education: Currently enrolled in sophomore year (or higher) working towards a B.E/B.Tech in Computer Science, Information Technology, or Circuit Branches"
  ],
  "responsibilities": [
    "Software Development",
    "Distributed Systems",
    "Testing & Automation",
    "Cloud Monitoring",
    "Cross-Functional Collaboration"
  ],
  "discoveredVia": "https://freshersdunia.in/salesforce-off-campus-internship-2026/",
  "discoveredAt": "2026-08-12T05:14:35",
  "extractedAt": "2026-08-12T17:44:51.275Z"
}