{
  "company": "Wipro Limited",
  "role": "Graduate Engineer Trainee",
  "jobType": "full-time",
  "batchYears": [
    "2024",
    "2025",
    "2026"
  ],
  "qualifications": [
    "B.E/B.Tech, M.E/M.Tech, BCA, MCA, or B.Sc"
  ],
  "experienceRequired": null,
  "salary": "₹4 to 6 LPA (Expected)",
  "locations": [
    "Bengaluru",
    "Hyderabad",
    "Mumbai",
    "Chennai"
  ],
  "lastDateToApply": null,
  "applyUrl": "https://careers.wipro.com/job/Graduate-Engineer-Trainee/190712-en_US",
  "skills": [],
  "requirements": [
    "Freshers / Experienced"
  ],
  "responsibilities": [
    "Work on software testing, automation, defect management, and quality assurance processes for enterprise applications and platforms."
  ],
  "discoveredVia": "https://freshersdunia.in/wipro-off-campus-hiring-2026-3/",
  "discoveredAt": "2026-08-11T04:44:14",
  "extractedAt": "2026-08-12T18:02:15.901Z"
}