{
  "company": "Amazon",
  "role": "Software Development Engineer I (SDE I)",
  "jobType": "full-time",
  "batchYears": [
    "2025",
    "2026"
  ],
  "qualifications": [
    "Bachelor's Degree or above in Computer Science, Computer Engineering, or a closely related technical field"
  ],
  "experienceRequired": "Freshers (0 Years)",
  "salary": "10- 20 LPA",
  "locations": [
    "Hyderabad",
    "Bangalore",
    "Chennai",
    "Maharashtra",
    "Delhi"
  ],
  "lastDateToApply": "Rolling Basis (Apply ASAP)",
  "applyUrl": "https://www.amazon.jobs/en/jobs/10454435/software-dev-engineer-i-amazon-university-talent-acquisition",
  "skills": [
    "C/C++",
    "Python",
    "Java",
    "Perl",
    "object-oriented design (OOP)",
    "algorithm design",
    "data structures",
    "problem-solving",
    "complexity analysis (Big-O)"
  ],
  "requirements": [
    "Deep knowledge of core Computer Science fundamentals",
    "Strong proficiency in programming languages"
  ],
  "responsibilities": [
    "Innovative Development",
    "Scale & Speed",
    "System Architecture",
    "Problem Solving",
    "Agile Delivery"
  ],
  "discoveredVia": "https://freshersdunia.in/amazon-university-talent-acquisition-2026-hiring/",
  "discoveredAt": "2026-08-12T10:12:11",
  "extractedAt": "2026-08-12T17:42:01.523Z"
}