{
  "company": "Deloitte",
  "role": "Associate - Market Research and Insights",
  "jobType": "full-time",
  "batchYears": [
    "2023",
    "2024",
    "2025",
    "2026"
  ],
  "qualifications": [
    "Bachelor’s degree in Science, Engineering, or Business",
    "Master's Degree or Related Field"
  ],
  "experienceRequired": "Up to 3 years of experience in research and analytics (Freshers with strong analytical portfolios are welcome to apply)",
  "salary": null,
  "locations": [
    "Hyderabad, Karnataka"
  ],
  "lastDateToApply": null,
  "applyUrl": "https://usijobs.deloitte.com/en_US/careersUSI/JobDetail/USI-EH27-ES-MF-L25-Associate-Secondary-research-Hyderabad/354615",
  "skills": [
    "Database Expertise",
    "Survey Platforms (Confirmit, Qualtrics)",
    "Data Tools (Tableau, Microsoft Power BI, Qlik Sense, R, Python)",
    "MS Office (PowerPoint, Excel, Word, Outlook)"
  ],
  "requirements": [
    "Shift Flexibility: Must be comfortable working the 11 AM to 8 PM shift",
    "Core Technical & Research Skills"
  ],
  "responsibilities": [
    "Secondary Research: Conduct in-depth research using proprietary and public sources (like Factiva, OneSource, Bloomberg)",
    "Primary Research Support: Assist in primary research activities by designing questionnaires, programming/testing surveys (using Qualtrics/Confirmit), monitoring fieldwork, and sharing interim findings",
    "Data Visualization & Analytics: Prepare raw data for analysis and develop highly visual, client-ready outputs using tools such as Tableau, Microsoft Power BI, Qlik Sense, R, or Python .",
    "Insight Generation: Analyze qualitative and quantitative data to develop comprehensive reports, point-of-view materials, thought leadership content, and actionable business insights.",
    "Project Management: Manage multiple research and analytics assignments simultaneously while collaborating with Deloitte practitioners to deliver work aligned with strict quality and confidentiality expectations."
  ],
  "discoveredVia": "https://freshersdunia.in/deloitte-recruitment-2026/",
  "discoveredAt": "2026-08-10T12:22:46",
  "extractedAt": "2026-08-12T18:02:27.643Z"
}