{
  "company": "Wipro Limited",
  "role": "Associate Analyst",
  "jobType": "full-time",
  "batchYears": [
    "2024",
    "2025",
    "2026"
  ],
  "qualifications": [
    "B.E/B.Tech",
    "M.E/M.Tech",
    "BCA",
    "MCA",
    "Any Graduate"
  ],
  "experienceRequired": "Freshers",
  "salary": "₹ 3.5 - ₹6 LPA",
  "locations": [
    "Bengaluru",
    "Hyderabad",
    "Mumbai",
    "Chennai"
  ],
  "lastDateToApply": null,
  "applyUrl": "https://careers.wipro.com/job/Associate-analyst/190184-en_US",
  "skills": [
    "Customer handling and problem-solving skills",
    "Basic technical support knowledge",
    "Analytical thinking and troubleshooting ability"
  ],
  "requirements": [
    "Good communication and interpersonal skills",
    "Willingness to work in a customer support environment",
    "Basic technical troubleshooting knowledge"
  ],
  "responsibilities": [
    "Handle customer queries through calls and emails",
    "Provide technical troubleshooting and issue resolution",
    "Maintain records of client interactions and resolutions"
  ],
  "discoveredVia": "https://freshersdunia.in/wipro-off-campus-hiring-2026-2/",
  "discoveredAt": "2026-08-11T05:06:40",
  "extractedAt": "2026-08-12T17:44:54.063Z"
}