{
  "company": "Carrier Global Corporation",
  "role": "Associate Engineer",
  "jobType": "full-time",
  "batchYears": [
    "2026"
  ],
  "qualifications": [
    "Diploma",
    "Bachelor's Degree",
    "Master Degree"
  ],
  "experienceRequired": "Entry Level / Freshers",
  "salary": "Competitive / Best in Industry",
  "locations": [
    "Bangalore, Karnataka, India"
  ],
  "lastDateToApply": "ASAP",
  "applyUrl": "https://www.corporate.carrier.com",
  "skills": [
    "BMS platforms",
    "HVAC systems",
    "Automation controls",
    "Networking and control protocols",
    "AI-driven tools",
    "Data analytics",
    "Microsoft Excel"
  ],
  "requirements": [
    "Bachelor's degree or diploma in Electrical, Mechanical, or Instrumentation Engineering",
    "Knowledge of BMS platforms",
    "Understanding of HVAC systems",
    "Basic knowledge of networking and control protocols"
  ],
  "responsibilities": [
    "Monitor and operate the Building Management System (BMS)",
    "Analyze system alerts, alarms, and trends",
    "Ensure proper functioning of HVAC, electrical, lighting, and fire systems"
  ],
  "discoveredVia": "https://freshersdunia.in/carrier-global-off-campus-recruitment-2026/",
  "discoveredAt": "2026-08-12T06:01:13",
  "extractedAt": "2026-08-12T17:42:02.729Z"
}