{
  "company": "Medpace",
  "role": "Entry Level Software Engineer",
  "jobType": "full-time",
  "batchYears": [
    "2024",
    "2025",
    "2026"
  ],
  "qualifications": [
    "B.E/B.Tech",
    "M.E/M.Tech",
    "BCA",
    "MCA",
    "B.Sc"
  ],
  "experienceRequired": "0-2+ years",
  "salary": "₹ 6 to 11 LPA",
  "locations": [
    "Navi Mumbai, India"
  ],
  "lastDateToApply": null,
  "applyUrl": "https://careers.medpace.com/jobs/11927?lang=en-us&iis=Job%20Board&iisn=LinkedIn",
  "skills": [
    "C#",
    "Angular",
    "Webservices",
    "GraphQL",
    "Git",
    "relational databases",
    "Entity Framework",
    "Azure DevOps"
  ],
  "requirements": [
    "Bachelor's Degree in Computer Science",
    "Basic knowledge of programming",
    "databases",
    "problem-solving skills",
    "software development concepts"
  ],
  "responsibilities": [
    "Collect, analyze and document user requirements",
    "Design, modify, develop and support software applications",
    "Participate in software validation process",
    "Create software applications",
    "Communicate with team members",
    "Utilize skills in development areas"
  ],
  "discoveredVia": "https://freshersdunia.in/medpace-off-campus-drive-2026/",
  "discoveredAt": "2026-08-11T05:16:45",
  "extractedAt": "2026-08-12T17:44:52.713Z"
}