{
  "company": "Wipro",
  "role": "Graduate Engineer Trainee",
  "jobType": "trainee",
  "batchYears": ["2024", "2025", "2026"],
  "qualifications": ["B.E/B.Tech — CSE, IT, ECE", "BCA, B.Sc (IT)"],
  "experienceRequired": "Freshers",
  "salary": "3.5 LPA",
  "locations": ["Bengaluru", "Pune", "Chennai"],
  "lastDateToApply": "31 August 2026",
  "applyUrl": "https://careers.wipro.com/job/Graduate-Engineer-Trainee/190712-en_US",
  "skills": ["Java", "SQL", "Data Structures", "Communication"],
  "requirements": ["2024–2026 batch", "60% in 10th, 12th, graduation"],
  "responsibilities": ["Support client applications", "Troubleshoot and resolve incidents"],
  "discoveredVia": "https://freshersdunia.in/example/wipro-get",
  "discoveredAt": "2026-08-12T00:00:00",
  "extractedAt": "2026-08-12T22:00:00.000Z"
}